{
  "schema_version": "1.0.0",
  "project_id": "project.demo",
  "index_generation_id": "generation.current_index.005",
  "previous_index_generation_id": "generation.current_index.004",
  "slots": [
    {
      "slot_id": "p4.empirical_evidence_index.current",
      "record_id": "record.empirical_evidence.overlap_stabilized_score",
      "record_type": "empirical_evidence_index",
      "current_generation_id": "generation.empirical.001",
      "content_sha256": "92f46e9ed1803ed843134f3e0b285631dca746019cb670e81300a9c1bdb34786",
      "method_identity": {
        "stable_id": "method.overlap_stabilized_score",
        "version": 1,
        "definition_sha256": "b274bbb26acde9604faad22d05b3f4015f75491a31b5d0f67f139a64f7a7a4f1"
      },
      "publication_state": "formal",
      "record_position": "current",
      "alignment": {
        "state": "exact",
        "causes": [
          "exact_match"
        ],
        "assessed_at": "2026-08-01T15:02:00Z",
        "assessed_by": "theorist",
        "reasons": [
          "The current evidence index uses only evidence generated from the exact method definition."
        ],
        "assessed_method": {
          "stable_id": "method.overlap_stabilized_score",
          "version": 1,
          "definition_sha256": "b274bbb26acde9604faad22d05b3f4015f75491a31b5d0f67f139a64f7a7a4f1"
        }
      },
      "source_event_ids": [
        "event.record.published.001"
      ],
      "research_attention": {
        "level": "monitor",
        "open_item_ids": [
          "attention.preliminary_scope.001"
        ],
        "reasons": [
          "Evidence remains preliminary and covers a narrow simulation design."
        ],
        "next_question": "Should the researcher launch a comprehensive Phase 4 run before using the performance claim in a manuscript?"
      }
    },
    {
      "slot_id": "p4.empirical_synthesis.current",
      "record_id": "record.empirical_synthesis.overlap_stabilized_score",
      "record_type": "empirical_synthesis",
      "current_generation_id": "generation.empirical_synthesis.001",
      "content_sha256": "abababababababababababababababababababababababababababababababab",
      "method_identity": {
        "stable_id": "method.overlap_stabilized_score",
        "version": 1,
        "definition_sha256": "b274bbb26acde9604faad22d05b3f4015f75491a31b5d0f67f139a64f7a7a4f1"
      },
      "publication_state": "formal",
      "record_position": "current",
      "alignment": {
        "state": "exact",
        "causes": [
          "exact_match"
        ],
        "assessed_at": "2026-08-01T15:02:00Z",
        "assessed_by": "theorist",
        "reasons": [
          "The empirical synthesis reports only evidence applicable to the exact method definition."
        ],
        "assessed_method": {
          "stable_id": "method.overlap_stabilized_score",
          "version": 1,
          "definition_sha256": "b274bbb26acde9604faad22d05b3f4015f75491a31b5d0f67f139a64f7a7a4f1"
        }
      },
      "source_event_ids": [
        "event.empirical_synthesis.published.001"
      ],
      "research_attention": {
        "level": "monitor",
        "open_item_ids": [
          "attention.preliminary_scope.001"
        ],
        "reasons": [
          "The synthesis is aligned but remains limited to the preliminary design."
        ],
        "next_question": "Does the empirical conclusion persist in the comprehensive design?"
      }
    },
    {
      "slot_id": "p4.implementation_record.current",
      "record_id": "record.implementation.overlap_stabilized_score",
      "record_type": "implementation_record",
      "current_generation_id": "generation.implementation.001",
      "content_sha256": "bcbcbcbcbcbcbcbcbcbcbcbcbcbcbcbcbcbcbcbcbcbcbcbcbcbcbcbcbcbcbcbc",
      "method_identity": {
        "stable_id": "method.overlap_stabilized_score",
        "version": 1,
        "definition_sha256": "b274bbb26acde9604faad22d05b3f4015f75491a31b5d0f67f139a64f7a7a4f1"
      },
      "publication_state": "formal",
      "record_position": "current",
      "alignment": {
        "state": "exact",
        "causes": [
          "exact_match"
        ],
        "assessed_at": "2026-08-01T15:02:00Z",
        "assessed_by": "theorist",
        "reasons": [
          "The implementation record identifies the exact code and configuration used for the method."
        ],
        "assessed_method": {
          "stable_id": "method.overlap_stabilized_score",
          "version": 1,
          "definition_sha256": "b274bbb26acde9604faad22d05b3f4015f75491a31b5d0f67f139a64f7a7a4f1"
        }
      },
      "source_event_ids": [
        "event.implementation.published.001"
      ],
      "research_attention": {
        "level": "none",
        "open_item_ids": [],
        "reasons": []
      }
    },
    {
      "slot_id": "p4.phase_decision.current",
      "record_id": "decision.p4.preliminary",
      "record_type": "phase_decision",
      "current_generation_id": "generation.decision.p4.001",
      "content_sha256": "dc3d850fed4c26d0672b3a748d92772bde097bfd81294d75c8450ac303addee9",
      "method_identity": {
        "stable_id": "method.overlap_stabilized_score",
        "version": 1,
        "definition_sha256": "b274bbb26acde9604faad22d05b3f4015f75491a31b5d0f67f139a64f7a7a4f1"
      },
      "publication_state": "formal",
      "record_position": "current",
      "alignment": {
        "state": "exact",
        "causes": [
          "exact_match"
        ],
        "assessed_at": "2026-08-01T15:05:00Z",
        "assessed_by": "research_lead",
        "reasons": [
          "The decision brief summarizes the exact current Phase 4 record."
        ],
        "assessed_method": {
          "stable_id": "method.overlap_stabilized_score",
          "version": 1,
          "definition_sha256": "b274bbb26acde9604faad22d05b3f4015f75491a31b5d0f67f139a64f7a7a4f1"
        }
      },
      "source_event_ids": [
        "event.decision.published.001"
      ],
      "research_attention": {
        "level": "monitor",
        "open_item_ids": [
          "attention.preliminary_scope.001"
        ],
        "reasons": [
          "The current evidence is aligned but scientifically narrow."
        ],
        "next_question": "Should the researcher authorize a comprehensive Phase 4 run?"
      }
    }
  ],
  "publication_receipt_id": "publication.p4.001",
  "content_sha256": "33f6c926b9f8f58438de9c9cff428d6e6b94b107bb89a828603264b7966b2b98",
  "created_at": "2026-08-01T15:10:04Z",
  "last_event_sequence": 17,
  "event_root_sha256": "064fa786627c5a6e0ebd8f2611be9318345a42b15843bae5eff20184589baae4"
}
